{
  "$schema": "../../../../schemas/component_pack_manifest.schema.json",
  "pack_id": "welcome_pack",
  "version": "1.0.0",
  "display_name": "Welcome Pack",
  "components": [
    {
      "component_id": "panel:welcome",
      "kind": "panel",
      "display_name": "Welcome Panel",
      "impl": "builtin:markdown_panel",
      "assets": {
        "markdown": "welcome.md"
      }
    }
  ]
}
